{
  "data": {
    "id": "a1b2c3d4-e5f6-7890-abcd-ef1234567890",
    "personalisation": {
      "appointmentDate": "2025-08-01",
      "appointmentTime": "10:00",
      "firstName": "Jane",
      "surgeryName": "Test Surgery"
    },
    "templateId": "3a58a370-75ab-4788-a75e-cd2572a68523",
    "templateType": "NHS_APP",
    "testPatientNhsNumber": "9000000009"
  },
  "datacontenttype": "application/json",
  "dataschema": "https://notify.nhs.uk/events/schemas/ProofRequested/v1.json",
  "dataschemaversion": "1.0.0",
  "id": "f1e2d3c4-b5a6-7890-fedc-ba0987654321",
  "plane": "data",
  "source": "//notify.nhs.uk/app/nhs-notify-template-management-prod/main",
  "specversion": "1.0",
  "subject": "a1b2c3d4-e5f6-7890-abcd-ef1234567890",
  "time": "2025-07-29T10:05:45.145Z",
  "type": "uk.nhs.notify.template-management.ProofRequested.v1"
}
